Sentence number	Greek	Fowler	Jowett	Schleiermacher	Rahimi	Nikpour	Mohammadi	Mahmoudzadeh	Assimi						
0059-003|155.|Cr. 49b.8.	Σωκράτης. οὐδὲ ἀδικούμενον ἄρα ἀνταδικεῖν, ὡς οἱ πολλοὶ οἴονται, ἐπειδή γε οὐδαμῶς δεῖ ἀδικεῖν.	Socrates. And we ought not even to requite wrong with wrong, as the world thinks, since we must not do wrong at all.	Soc. Nor when injured injure in return, as the many imagine; for we must injure no one at all?	Sokrates: Also auch nicht der, dem Unrecht geschehen ist, darf wieder Unrecht tun, wie die meisten glauben, wenn man doch auf keine Weise Unrecht tun darf?	ونه اینکه زیان‌دیده مقابله به مثل کند , چنانکه اکثریت باوردارند , چراکه نباید به هبچ وجه خطا کرد .	بنابراین ستم‌دیده , آنطور که عموم مردم بر این باورند , نباید تلافی کند , زیرا خطاکردن هرگز جایز نیست	بنابراین فرد ستم‌دیده نباید مقابله به مثل کند، آنطور که عموم مردم باور دارند، چرا که کمابیش نباید به هیچ وجه بدی کرد.	سقراط: پس تلافی کردن بیداد بر بیدادکِش چنانچه اکثریت می‌پندارند نشاید، از این روی که بیداد کردن بایسته نیست .							
0059-003|156.|Cr. 49c.1.	Κρίτων. οὐ φαίνεται.	Crito. Apparently not.	Cr. Clearly not.	Kriton: Es scheint nicht.	به ظاهر نه	به نظر می‌رسد جایز نیست .	واضحاً نه.	کریتون: پیداست که نه .							
0059-003|157.|Cr. 49c.2.	Σωκράτης. τί δὲ δή;	Socrates. Well,	Soc. Again,	Sokrates: Und wie doch?	آخر چرا؟	بار دیگر	و اما چگونه؟	سقراط: البته، بعد چه ؟							
0059-003|158.|Cr. 49c.3.	κακουργεῖν δεῖ, ὦ Κρίτων, ἢ οὔ;	Crito, ought one to do evil or not?	Crito, may we do evil?	Darf man mißhandeln, oder nicht?	ای کریتون، شرارت را ایجاب می‌کند، یا نه؟	شرارت ای کریتون جایز است یا نه؟	بایستی بدی کرد، ای کریتون، یا نه؟	شرارت کردن ای کریتون ! بایسته است یا خیر ؟							
0059-003|159.|Cr. 49c.4.	Κρίτων. οὐ δεῖ δήπου, ὦ Σώκρατες.	Crito. Certainly not, Socrates.	Cr. Surely not, Socrates.	Kriton: Man darf es wohl nicht, Sokrates.	بدون شک ایجاب نمی‌کند , ای سقراط .	یحتمل جایز نیست ای سقراط	یقیناً نباید، ای سقراط.	کریتون: البته که بایسته نیست ای سقراط .							
0059-003|160.|Cr. 49c.5.	Σωκράτης. τί δέ;	Socrates. Well, then,	%In next sentence%	Sokrates: Aber wie?	اما چرا؟	بسیارخب	اما چگونه؟	و بعد؟							
0059-003|161.|Cr. 49c.6.	ἀντικακουργεῖν κακῶς πάσχοντα, ὡς οἱ πολλοί φασιν, δίκαιον ἢ οὐ δίκαιον;	is it right to requite evil with evil, as the world says it is, or not right?	Soc. And what of doing evil in return for evil, which is the morality of the many-is that just or not?	Wieder mißhandeln, nachdem man schlecht behandelt worden ist, – ist das, wie die meisten sagen, gerecht oder nicht?	خشونت متقابلِ آزاردیده , همچنان که مورد تصدیق همگان است , درست است یا نادرست؟	آیا تلافی شرارت از سوی شرارت‌دیده , آنطور که عموم مردم توافق دارند , خطاست یا خطا نیست؟	فرد رنجور با بدی مقابله به مثل کند، آنطور که عموم مردم تأیید می‌کنند، درست است یا نادرست؟	تلافی شرارت از طرف او که شرارت بر او رفته چنانچه اکثریت مدعی‌اند، بیداد کردن باشد یا خیر ؟							
0059-003|162.|Cr. 49c.7.	Κρίτων. οὐδαμῶς.	Crito. Not right, certainly.	Cr. Not just.	Kriton: Auf keine Weise.	به هیچ وجه .	مطلقاً [ خطاست ] .	به هیچ وجه.	کریتون: هرگز .							
0059-003|163.|Cr. 49c.8.	Σωκράτης. τὸ γάρ που κακῶς ποιεῖν ἀνθρώπους τοῦ ἀδικεῖν οὐδὲν διαφέρει.	Socrates. For doing evil to people is the same thing as wronging them.	Soc. For doing evil to another is the same as injuring him?	Sokrates: Denn jemanden schlecht behandeln, ist nicht unterschieden vom Unrecht tun.	چراکه شاید اعمال بدی  بر هر کسی هیچ تفاوتی  با خطاکاری ندارد.	زیرا با انسان‌ها شریرانه عمل‌کردن تقریباً هیچ فرقی با خطاکردن نمی‌کند .	چرا که بدی کردن به آدمیان در هر جایی با بیدادگری تفاوتی ندارد.	سقراط: زیرا مرتکب شرارت شدن به هر کجا و از بهرِ هر انسانی بلا تفاوت از بیدادگری است .	زیرا به هر روی بدی رساندن به آدمیان هیچ فرقی با خطاکاری ندارد .						
0059-003|164.|Cr. 49c.9.	Κρίτων. ἀληθῆ λέγεις.	Crito. That is true.	Cr. Very true.	Kriton: Wahr gesprochen!	درست میگویی .	درست می‌گویی .	درست می‌گویی.	کریتون: راست می‌گویی .	درست می گویی .						
0059-003|165.|Cr. 49c.10.	Σωκράτης. οὔτε ἄρα ἀνταδικεῖν δεῖ οὔτε κακῶς ποιεῖν οὐδένα ἀνθρώπων, οὐδ᾽ ἂν ὁτιοῦν πάσχῃ ὑπ᾽ αὐτῶν.	Socrates. Then we ought neither to requite wrong with wrong nor to do evil to anyone, no matter what he may have done to us.	Soc. Then we ought not to retaliate or render evil for evil to anyone, whatever evil we may have suffered from him.	Sokrates: Also weder wiederbeleidigen darf man, noch irgend einen Menschen mißhandeln, und wenn man auch von ihm erleidet, was es immer sei.	پس نه بدرفتاری متقابل و نه بدرفتاری به هیچ یک از افراد مجاز نیست , نه حتی به هرکس که به ما بدی رسانده باشد .	بنابراین , نه تلافی خطا جایز است , نه شریرانه عمل‌کردن با هیچ انسانی , نه حتی با هر آنچه که به ما رنج رسانده باشد	پس نباید مقابله به مثل کردن و نه بدرفتاری با هیچ یک از آدمیان، صرف‌نظر از هر چیزی که به دست آن‌ها تحمیل شده باشد.	سقراط: پس علیه هیچ یک از انسان‌ها نه تلافی کردن لازم آید و نه ارتکاب شرارت، حتی اگر علیه آن‌هایی باشد که از جانب ایشان رنجی بر ما رفته است .	پس هیچ انسانی را نه می بایست بدی رساند و نه پاد-آزرد , صرف نظر از آنچه که بر ما رفته باشد .						
0059-003|166.|Cr. 49d.1.	καὶ ὅρα, ὦ Κρίτων, ταῦτα καθομολογῶν, ὅπως μὴ παρὰ δόξαν ὁμολογῇς:	And be careful, Crito, that you do not, in agreeing to this, agree to something you do not believe;	But I would have you consider, Crito, whether you really mean what you are saying.	Und siehe wohl zu, Kriton, wenn du dies eingestehst, daß du es nicht gegen deine Meinung eingestehst!	و بنگر ای کریتون , مبادا که موافقت تو با این [ امر ] به منزله قبول [ چیزی ] خلاف عقیده‌ تو باشد .	و ای کریتون تیزنگر , در اقرار به این , که برخلاف عقیده‌ت موافقت نکرده باشی .	و بنگر، ای کریتون، که مبادا با اقرار به این، عقیده‌ای ناهمسو را بپذیری:	بعلاوه ای کریتون ! بیندیش تا نکند با صحه گذاشتن به این‌ها، چیزی را بر خلاف رأی خود بپذیری .	و بنگر ای کریتون که با پذیرفتن این سخن به هر صورت مبادا با چیزی ناسازگار با رای متعارف موافقت کرده باشی						
0059-003|167.|Cr. 49d.2.	οἶδα γὰρ ὅτι ὀλίγοις τισὶ ταῦτα καὶ δοκεῖ καὶ δόξει.	for I know that there are few who believe or ever will believe this.	For this opinion has never been held, and never will be held, by any considerable number of persons;	Denn ich weiß wohl, daß nur wenige dieses glauben und glauben werden.	چرا که می‌دانم نه تنها قلیل‌اند آنها که به این امر اعتقاد دارند بلکه [ معدود کسانی ] بر این باور خواهند بود .	چراکه من مطمئن شده‌ام که اندک کسانی این را مفروض می‌گیرند یا مفروض خواهند گرفت .	چون می‌دانم که کسان اندکی نیز این را باور داشته و باور خواهند داشت.	زیرا می‌دانم آنان که این‌ها را باور دارند و نیز بر این باور خواهند بود کم‌‌شمارند .	, زیرا می دانم که اندک اند کسانی که این را باور دارند و باور خواهند داشت .						
0059-003|168.|Cr. 49d.3.	οἷς οὖν οὕτω δέδοκται καὶ οἷς μή, τούτοις οὐκ ἔστι κοινὴ βουλή, ἀλλὰ ἀνάγκη τούτους ἀλλήλων καταφρονεῖν ὁρῶντας ἀλλήλων τὰ βουλεύματα.	Now those who believe this, and those who do not, have no common ground of discussion, but they must necessarily, in view of their opinions, despise one another.	and those who are agreed and those who are not agreed upon this point have no common ground, and can only despise one another, when they see how widely they differ.	Welche also dies annehmen, und welche nicht, für die gibt es keine gemeinschaftliche Beratschlagung; sondern sie müssen notwendig einander gering achten, wenn einer des andern Entschließungen sieht.	در واقع آنها که به این [امر] معتقدند و آنها که نه، زمینه ‌ای مشترک ندارند، ولی نباید آراء یکدیگر را نیز به دیده تحقیر بنگرند.	. مسلماً آنانی که بدین طریق پنداشته‌اند و آنانی که نه , نیت مشترکی برای اینان نیست , اما اینان , در نگریستن به نیات یکدیگر ناگزیرند از خوار نگریستن یکدیگر .	اکنون آنانی که این را باور دارند و آنانی که ندارند، آنان را نقطه نظر مشترکی نیست، بلکه آن‌ها به ناچار با نظاره پویه همدیگر، یکدیگر را خرد می‌شمارند.	حال برای آنان که بدین باورند و برای آنان که نه، مذاکره‌ای مشترک متصور نیست؛ اما آنان چون غرض‌های یکدگر دریابند لزوماً یکدگر را خوار شمارند .	حال آنان که چنین باوری دارند و آنانکه نه , هیچ بنیاد مشترکی در بحث نداشته و ضرورت برای آنها تحقیر یکدیگر با نگاه بر غایات همدیگر است .						
0059-003|169.|Cr. 49d.4.	σκόπει δὴ οὖν καὶ σὺ εὖ μάλα πότερον κοινωνεῖς καὶ συνδοκεῖ σοι καὶ ἀρχώμεθα ἐντεῦθεν βουλευόμενοι, ὡς οὐδέποτε ὀρθῶς ἔχοντος οὔτε τοῦ ἀδικεῖν οὔτε τοῦ ἀνταδικεῖν οὔτε κακῶς πάσχοντα ἀμύνεσθαι ἀντιδρῶντα κακῶς, ἢ ἀφίστασαι καὶ οὐ κοινωνεῖς τῆς ἀρχῆς;	Do you therefore consider very carefully whether you agree and share in this opinion, and let us take as the the starting point of our discussion the assumption that it is never right to do wrong or to requite wrong with wrong, or when we suffer evil to defend ourselves by doing evil in return. Or do you disagree and refuse your assent to this starting point?	Tell me, then, whether you agree with and assent to my first principle, that neither injury nor retaliation nor warding off evil by evil is ever right. And shall that be the premise of our agreement? Or do you decline and dissent from this?	Überlege also auch du recht wohl, ob du Gemeinschaft mit mir machst und dies auch annimmst und wir hiervon unsere Beratung anfangen wollen, daß niemals weder beleidigen noch wiederbeleidigen recht ist, noch auch, wenn einem Übles geschieht, sich dadurch helfen, daß man wieder Übles zufügt; oder ob du abstehst und du keinen Teil haben willst an diesem Anfang?	پس تو به درستی و به تمامی بسنج که آیا نزد تو به نظر درست می‌آید که رایزنی را از این نقطه آغاز کنیم که تلافی نادرستی با نادرستی هرگز درست نبوده و خطا است و رنج بردنمان از بدی را نباید به قصد محافظت از خود با بدکاری متقابل تقاص بگیریم. یا احتراز می‌کنی و در این اصل آغازین مشارکت نمی‌کنی؟	بنابراین بس نیک بیندیش که آیا تو هم‌نظری و هم‌رأی‌اند با تو و از اینجا بیاغازیم که این فرض که هرگز درست نیست نه خطاکردن و نه تلافی خطا و نه شرارت‌دیده را تقاص‌گرفتن در مقابله با شرارت , یا مخالفی و هم‌نظر نیستی با این آغاز؟	حال اینک نیز تو بسیار خوب بسنج که آیا تو هم‌رأی و هم‌عقیده هستی و از این منظر شروع می‌کنیم، که نه بدی کردن نه مقابله به مثل و نه واکنش بدی نشان دادن برای انتقام‌گیری به هنگام رنجور گشتن هرگز درست نیستند، یا از این دیدگاه دوری می‌جویی و هم‌رأی نیستی؟	اینک به عینه بس نیک درنگر که آیا تو نیز هم‌رأی و متفق‌ایی ؟ بگذار از این جا آغاز کنیم، با اتکا به آنچه قصد کرده‌ ایم که هرگز نه تلافی کردن بیداد و نه دفاع در عوضِ شرارت از سوی اویی که متحمل شرارت شده، درست نیست؛ یا با این سرآغاز مخالفی و خود را از آن بری می‌دانی ؟	تو نیز حقیقتا بس نیک بسنج که آیا همراهی و در نظرت همینطور است تا سپس با این فرض آغاز کنیم که هرگز نه آزردن و نه پاد-آزردن و نه بدی رساندن و در مقام دفاع با بدی واکنش کردن درست نیست و یا مخالفی و با این سرآغاز همراه نیستی ؟						
0059-003|170.|Cr. 49e.1.	ἐμοὶ μὲν γὰρ καὶ πάλαι οὕτω καὶ νῦν ἔτι δοκεῖ, σοὶ δὲ εἴ πῃ ἄλλῃ δέδοκται, λέγε καὶ δίδασκε.	For I have long held this belief and I hold it yet, but if you have reached any other conclusion, speak and explain it to me.	For this has been of old and is still my opinion; but, if you are of another opinion, let me hear what you have to say.	Ich meinesteils habe schon immer dieses angenommen und auch jetzt noch. Du aber, nimmst du irgend etwas anderes an, so sprich und trage es vor:	من برای مدت مدیدی و هنوز هم این اعتقاد را دارم , اما اگر تو هر اعتقاد دیگری داری , [ آن را ] بگوی و شرح کن .	چراکه براستی برای من دیرزمانی است که این‌گونه به نظر می‌رسد و اکنون [ نیز ] همچنان چنین است . اما اگر تو به گونه‌ی دیگری پنداشته‌ای , بگو و ارائه کن .	همانا نیز چون از مدت مدیدی و حتی هنوز بر این باورم، اما اگر تو به هر نتیجه دیگری دست یافته‌ای، سخن گوی و تعلیم ده.	چرا که در حقیقت روزگاریست که من بر این باورم و هنوز هم، لیکن اگر هر چیز دیگری به نظر تو رسیده است بگوی و بیاگاه .	زیرا دیری است که مرا باور چنین است و اکنون نیز . اگر به هر روی تو را باور دیگر است بگو و تعلیم ده ,						
0059-003|171.|Cr. 49e.2.	εἰ δ᾽ ἐμμένεις τοῖς πρόσθε, τὸ μετὰ τοῦτο ἄκουε.	If you still hold to our former opinion, hear the next point.	If, however, you remain of the same mind as formerly, I will proceed to the next step.	bleibst du aber bei dem Ehemaligen, so höre nun das Weitere!	اما اگر به [ استدلال ] پیشین ما پایبندی , آن بعدی را بشنو .	اما اگر به این [ عقیده‌ی ] قبلی پایبندی , بشنو این مطلب دیگر را .	حتی اگر بر آن [گزاره] پیشین پایبندی، به این [گزاره] پسین گوش فراده.	امّا اگر بر سر رأی پیشین ما مانده‌ایی، نکتۀ بعدی را گوش فرا ده .	اما اگر به سخن پیشین ما پایبندی , بعدی را بنیوش .						
0059-003|172.|Cr. 49e.3.	Κρίτων. ἀλλ᾽ ἐμμένω τε καὶ συνδοκεῖ μοι:	Crito. I do hold to it and I agree with you;	Cr. You may proceed, for I have not changed my mind.	Kriton: Allerdings bleibe ich dabei und nehme es mit dir an.	نه تنها به آن پایبندم بلکه به آن معتقدم :	پایبند و هم‌رأیم ,	البته که پایداری می‌ورزم/پایبندم و نیز باور هم دارم:	کریتون: البتّه بر آن‌ام و متفق الرأی .	هم پایبندم و هم در نزدم نیک است ,						
0059-003|173.|Cr. 49e.4.	ἀλλὰ λέγε.	so go on.	%In Previous sentence%	Also rede!	پس بگوی	پس بگو .	لیک بگو.	پس بگوی .	باری بگو						
0059-003|174.|Cr. 49e.5.	Σωκράτης. λέγω δὴ αὖ τὸ μετὰ τοῦτο, μᾶλλον δ᾽ ἐρωτῶ:	Socrates. Now the next thing I say, or rather ask, is this:	Soc. Then I will proceed to the next step, which may be put in the form of a question:	Sokrates: Ich sage also hierauf weiter, oder vielmehr ich frage,	اکنون آن مورد دیگر را می‌گویم , یا بهتر بگویم ( ترجیحاً ) می‌پرسم :	پس این مطلب دیگر را بازگو می‌کنم , یا بهتر , می‌پرسم :	حال آن [گزاره] پسین را باز می‌گویم، اما بهتر است بپرسم:	سقراط: حال من نکته بعدی را می‌گویم یا به بیانی بهتر می‌پرسم ؛	حال دیگر نکته بعد را می گویم , بلکه می پرسم :						
0059-003|175.|Cr. 49e.6.	πότερον ἃ ἄν τις ὁμολογήσῃ τῳ δίκαια ὄντα ποιητέον ἢ ἐξαπατητέον;	“ought a man to do what he has agreed to do, provided it is right, or may he violate his agreements?”	Ought a man to do what he admits to be right, or ought he to betray the right?	ob, was jemand jemandem Gerechtes versprochen hat, er auch leisten müsse, oder ob er betrügen dürfe?	هرکس  ملزم به انجام آنچه که بردرستی آن توافق دارد است  یا مجاز به خلاف عهد؟	آیا فرد باید به آنچه موافقت کرده که درست است عمل کند یا باید تزویر کند؟	آیا عملی را که فرد باور دارد درست است باید انجام دهد یا [از آن] طفره رود؟	اگر بر سر آنچه که دادگرانه است توافقی حاصل شود آیا باید بدان عمل کرد یا باید نیرنگ زد ؟	آیا آنکس که پذیرفته که عادل باشد بایسته است که اهل عمل باشد یا اهل دغل ؟						
0059-003|176.|Cr. 49e.7.	Κρίτων. ποιητέον.	Crito. He ought to do it.	Cr. He ought to do what he thinks right.	Kriton: Leisten muß er es.	ملزم به انجام دادن .	باید عمل کند .	باید انجام دهد.	کریتون: باید عمل کرد .	اهل عمل						
0059-003|177.|Cr. 49e.8.	Σωκράτης. ἐκ τούτων δὴ ἄθρει.	Socrates. Then consider whether,	Soc. But if this is true, what is the application?	Sokrates: Von hier aus nun schaue um:	بنابراین زین پس این موارد را بسج .	پس از این [ منظر ] بنگر :	حال از این [منظر] بنگر.	سقراط: پس با در نظر گرفتنِ این‌ها تأمل کن .	از همین جا بنگر ,						
0059-003|178.|Cr. 50a.1.	ἀπιόντες ἐνθένδε ἡμεῖς μὴ πείσαντες τὴν πόλιν πότερον κακῶς τινας ποιοῦμεν, καὶ ταῦτα οὓς ἥκιστα δεῖ, ἢ οὔ;	if we go away from here without the consent of the state, we are doing harm to the very ones to whom we least ought to do harm, or not,	In leaving the prison against the will of the Athenians, do I wrong any? or rather do I not wrong those whom I ought least to wrong?	Wenn wir, ohne die Stadt zu überreden, von hier weggehn, behandeln wir dann jemanden schlecht, und zwar die, welchen es am wenigsten geschehen sollte, oder nicht?	رفتن ما از اینجا بی‌اقناع شهر، آیا ستم به فرد و افرادی است که مستحق کمترین بدی هستند یا نه؟	اگر ما از اینجا برویم , بدون متقاعدکردن پولیس , آیا شریرانه عمل‌کردن در قبال کسانی است , که باید اقلِ شرارت در قبال اینان صورت گیرد , یا نه؟	با رفتن ما از اینجا بدون کسب رضایت دولت‌شهر آیا در حق کسانی بدی کرده‌ایم، آنانی که نیز مستحق کمترین‌ [بدی] اند، یا نه؟	اگر ما بی مُجاب کردن شهر این‌جا را ترک گوییم آیا جفا کردن بر آنانی است که بایستی سزاوارِ کم‌ترین جفا باشند یا خیر ؟	آیا برون رفتن ما از اینجا بی اجازه دولت-شهر بدی کردن به کسانی است که کمترین بدی را می باید یا خیر ؟						
0059-003|179.|Cr. 50a.2.	καὶ ἐμμένομεν οἷς ὡμολογήσαμεν δικαίοις οὖσιν ἢ οὔ;	and whether we are abiding by what we agreed was right, or not.	Do I not desert the principles which were acknowledged by us to be just? What do you say?	Und halten wir fest an den, was wir Gerechtes versprochen haben, oder nicht?	و به آنچه به درستی وعده داده ایم پایبند هستیم یا نه؟	و آیا پایبندیم به آنچه موافقت کردیم که درست است یا نه؟	و پایبندیم بر آنچه که هم‌سگال شدیم که درست بود یا نه؟	بعلاوه بدان‌چه که بر دادگرانه بودن‌اش توافق کرده‌ایم پایبندیم یا خیر ؟	و ما بر سر آنچه توافق کردیم که درست است ایستاده ایم یا خیر ؟						
0059-003|180.|Cr. 50a.3.	Κρίτων. οὐκ ἔχω, ὦ Σώκρατες, ἀποκρίνασθαι πρὸς ὃ ἐρωτᾷς:	Crito. I cannot answer your question, Socrates,	Cr. I cannot tell, Socrates,	Kriton: Darauf weiß ich nicht zu antworten, Sokrates, was du fragtest:	پاسخ این پرسش تو را نمی‌دانم ای سقراط	ای سقراط , من پاسخی ندارم درباب آنچه می‌پرسی	نمی‌توانم پاسخی دهم، ای سقراط، برای آنچه که پرسیدی:	کریتون: ای سقراط من در قبال آنچه می‌پرسی پاسخی ندارم ،	ای سقراط پاسخی برای پرسش تو ندارم						
0059-003|181.|Cr. 50a.4.	οὐ γὰρ ἐννοῶ.	for I do not understand.	for I do not know.	denn ich verstehe es nicht.	چراکه [ آن را ] نمی‌فهمم .	چراکه درک نمی‌کنم .	چرا که درک نمی‌کنم.	چرا که در نمی‌یابم .	زیرا درکش نمیکم .						
0059-003|182.|Cr. 50a.5.	Σωκράτης. ἀλλ᾽ ὧδε σκόπει.	Socrates. Consider it in this way.	Soc. Then consider the matter in this way:	Sokrates: Erwäge es denn so:	پس اینطور در نظر بگیر .	پس این‌گونه بیندیش .	به گونه دیگر بسنج.	سقراط: پس چنین درنگر .	پس چنین بسنج :						
