Sentence number	Greek	Fowler	Jowett	Schleiermacher	Rahimi	Nikpour	Mohammadi	Mahmoudzadeh	Assimi						
0059-003|231.|Cr. 52e.2.	σὺ δὲ οὔτε Λακεδαίμονα προῃροῦ οὔτε Κρήτην, ἃς δὴ ἑκάστοτε φῂς εὐνομεῖσθαι, οὔτε ἄλλην οὐδεμίαν τῶν Ἑλληνίδων πόλεων οὐδὲ τῶν βαρβαρικῶν, ἀλλὰ ἐλάττω ἐξ αὐτῆς ἀπεδήμησας ἢ οἱ χωλοί τε καὶ τυφλοὶ καὶ οἱ ἄλλοι ἀνάπηροι:	But you preferred neither Lacedaemon nor Crete, which you are always saying are well governed, nor any other of the Greek states,or of the foreign ones, but you went away from this city less than the lame and the blind and the other cripples.	You had your choice, and might have gone either to Lacedaemon or Crete, which you often praise for their good government, or to some other Hellenic or foreign State.	Du aber hast weder Lakedaimon vorgezogen noch Kreta, die du doch immer rühmst als wohlgeordnete Staaten, noch irgend einen andern von den hellenischen Staaten oder von den unhellenischen, sondern weniger hast du dich von hier entfernt als die Lahmen, Blinden und andere Verstümmelten.	ولی تو نه لاکِدایمون را ترجیح دادی و نه کرِتِ , آنها که همیشه و آشکارا می‌گویی خوب اداره می‌شوند , و نه هیچکدام از دیگر شهرهای یونانی و غیریونانی [ را ترجیح ندادی ] , بلکه کمتر از چلاق‌ها و کورها و دیگر افراد علیل از اینجا بیرون رفته‌ای .	اما تو نه لاکدایمون را ترجیح می‌دادی و نه کرت را , همان‌هایی که همواره از انتظام‌شان داد سخن می‌دهی , و نه هیچ‌یک از دیگر . ایالات یونان و نه [ شهرهای ] بیگانه , بلکه کمتر از شَلان و کوران و دیگر افراد علیل به آنجا سفر کردی	اما تو نه لاکدایمون و نه کرت را ترجیح دادی، که به جد هر بار می‌گویی قانون‌مدار هستند، نه هیچ یک از دیگر دولت‌شهرهای یونانی و نه بربرها را، حتی کمتر از شَلان و نیز نابینایان و دیگر معلولان از آن دور گشتی:	لیکن تو نه لاکدمون را برگزیدی نه کرت را، جاهایی که مدام از کمالِ قانون مداری‌شان سخن می‌رانی و نه هیچ یک از شهرهای دیگر یونان و غیر یونان را، بلکه کم‌تراز شلان، کوران و باقی علیلان از آن دور شدی .							
0059-003|232.|Cr. 53a.1.	οὕτω σοι διαφερόντως τῶν ἄλλων Ἀθηναίων ἤρεσκεν ἡ πόλις τε καὶ ἡμεῖς οἱ νόμοι δῆλον ὅτι:	So much more than the other Athenians were you satisfied with the city and evidently therefore with us, its laws;	Whereas you, above all other Athenians, seemed to be so fond of the State, or, in other words, of us her laws	So vorzüglich vor allen Athenern hat dir die Stadt gefallen, und wir, die Gesetze, also auch.	از این روی آشکار است که هم شهر و هم ما  قوانین، تو را بیش از آن دیگر آتنیان خشنود کرده‌ایم.	بنابراین , در تو , بیش از دیگر آتنیان , از پولیس/دولت‌شهر خرسندی بود و آشکار بود که از ما قوانین نیز :	پس چنین که هویداست دولت‌شهر و نیز ما (قوانین) تو را بیش از دیگر آتنیان تطمیع ساخته‌ایم:	چندان که دولت‌شهر و ما قوانین، بیش‌تر از دیگر آتنیان باب میل تو بود ، این نیز عیان است .							
0059-003|233.|Cr. 53a.2.	τίνι γὰρ ἂν πόλις ἀρέσκοι ἄνευ νόμων;	for who would be pleased with a city apart from its laws?	(for who would like a State that has no laws?), that you never stirred out of her: the halt, the blind, the maimed, were not more stationary in her than you were.	Denn wem würde eine Stadt wohl gefallen ohne die Gesetze?	شهر فاقد قوانین برای چه کسی خوشایند خواهد بود؟	چراکه دولت‌شهر فاقد قوانین که را خرسند می‌کند؟	چرا که چه کسی از دولت‌شهرِ فاقد قوانین تطمیع خواهد گشت؟	آخر کیست که از دولت‌شهر راضی باشد، از قوانین نه ؟							
0059-003|234.|Cr. 53a.3.	νῦν δὲ δὴ οὐκ ἐμμενεῖς τοῖς ὡμολογημένοις;	And now will you not abide by your agreement?	And now you run away and forsake your agreements.	Und nun also willst du doch dem Versprochenen nicht treu bleiben?	و حال به عهد‌های که بسته‌ای وفادار نمی‌مانی؟	بااین‌حال اکنون به این توافق پایبند نمی‌مانی؟	پس اما اکنون پیروی نمیکنی از هم‌سگالی‌ات؟	اما اکنون از توافق‌های انجام گرفته پیروی نمی‌کنی ؟							
0059-003|235.|Cr. 53a.4.	ἐὰν ἡμῖν γε πείθῃ, ὦ Σώκρατες:	You will if you take our advice, Socrates;	Not so, Socrates, if you will take our advice; do not make yourself ridiculous by escaping out of the city.	Wohl wirst du es, wenn du uns folgst, o Sokrates,	ای سقراط , اگر از ما پیروی کنی :	ای سقراط , چنانچه به ما گوش فرادهی :	اگر دست‌کم از ما پیروی کنی، ای سقراط:	ای سقراط ! اگر از ما پیروی نمایی، باشد تا :							
