Sentence number	Greek	Fowler	Jowett	Schleiermacher	Rahimi	Nikpour	Mohammadi	Mahmoudzadeh	Assimi						
0059-003|76.|Cr.46b.4.	ὡς ἐγὼ οὐ νῦν πρῶτον ἀλλὰ καὶ ἀεὶ τοιοῦτος οἷος τῶν ἐμῶν μηδενὶ ἄλλῳ πείθεσθαι ἢ τῷ λόγῳ ὃς ἄν μοι λογιζομένῳ βέλτιστος φαίνηται.	for I am not only now but always a man who follows nothing but the reasoning which on consideration seems to me best.	For I am and always have been one of those natures who must be guided by reason, whatever the reason may be which upon reflection appears to me to be the best;	Denn nicht jetzt nur, sondern schon immer habe ich ja das an mir, daß ich nichts anderem von mir gehorche, als dem Satze, der sich mir bei der Untersuchung als der beste zeigt.	چراکه من نه نخستین بار بلکه در همه حال چنان ‌ام که هیچ‌یک از دوستانم را پیروی نمی‌کنم مگر آن استدلال که به نظر من باید عالی‌ترین به شمار آید .	بنابراین , من نه اکنون برای اولین‌بار , بلکه همیشه از آن دست کسانی بوده‌ام که از هیچ‌چیز فرمان نبرده‌ام جز برهانی که مستدل‌ شده بر من معلوم شود بهترین است .	چنانکه من و نه فقط اکنون بلکه همیشه همچو کسی برای خودم بوده‌ام که با پیروی کردن از هیچ چیز به جز سگالی که با سبک-سنگین کردن، بهترین برای من آشکار شود.	از آنجایی که من نه اکنون برای نخستین بار , بلکه همواره از جمله ی آنانی گشتم از آنِ خود , چه رهرو چیزی نشدن را توانستم , مگر از برهانی سنجیده که مسلم گردد برای من بهترین است .							
0059-003|77.|Cr.46c.1.	τοὺς δὴ λόγους οὓς ἐν τῷ ἔμπροσθεν ἔλεγον οὐ δύναμαι νῦν ἐκβαλεῖν, ἐπειδή μοι ἥδε ἡ τύχη γέγονεν, ἀλλὰ σχεδόν τι ὅμοιοι φαίνονταί μοι, καὶ τοὺς αὐτοὺς πρεσβεύω καὶ τιμῶ οὕσπερ καὶ πρότερον:	And I cannot, now that this has happened to us, discard the arguments I used to advance, but they seem to me much the same as ever, and I revere and honor the same ones as before.	and now that this fortune has come upon me, I cannot put away the reasons which I have before given: the principles which I have hitherto honored and revered I still honor,	Das aber, was ich schon ehedem in meinen Reden festgesetzt habe, kann ich ja nun nicht verwerfen, weil mir dieses Schicksal geworden ist; sondern jene Reden erscheinen mir noch ganz als dieselben, und ich schätze und ehre sie noch eben so wie vorher.	حال که چنین سرنوشتی برایم رقم خورده است , نمی‌توانم استدلال‌هایی را که پیش‌تر از آنها دم زده‌ام کنار بگذارم . به جز این , براستی همانها را که حفظ کرده و همچون گذشته ارج می‌نهم برای من کم و بیش [ استدلال‌هایی ] همواره ثابت به نظر می‌رسند :	باری حال پس از آنکه چنین سرنوشتی برای من رخ داده است نمی‌توانم آن سخنانی را که در گذشته به زبان می‌راندم کنار بگذارم , بماند که آن‌ها کمابیش همان‌سان بر من آشکار می‌شوند , و آن‌ها را به‌رسم سابق مقدم می‌دانم و ارج می‌نهم .	پس این سخنان را که از پیش می‌گفتم اکنون نمی‌توانم انکار کنم، حال که سرنوشت برای من این چنین رقم خورده است، اما برای من کمابیش همسان می‌نمایند، و نیز همین‌ها را ارج می‌نهم و همانند گذشته از صمیم قلب محترم می‌شمارم:	پس اینک پشت پا زدن بدان برهان هایی که تا کنون سخن می راندم با عذر این تیره بختی که برای من پیش آمده است از من بر نمی آید , چه هنوز هم کمابیش یکسان بر من پدیدار می گردند و من این ها را به رسم گذشته ارج و قرب می نهم .							
0059-003|78.|Cr.46c.2.	ὧν ἐὰν μὴ βελτίω ἔχωμεν λέγειν ἐν τῷ παρόντι, εὖ ἴσθι ὅτι οὐ μή σοι συγχωρήσω, οὐδ᾽ ἂν πλείω τῶν νῦν παρόντων ἡ τῶν πολλῶν δύναμις ὥσπερ παῖδας ἡμᾶς μορμολύττηται, δεσμοὺς καὶ θανάτους ἐπιπέμπουσα καὶ χρημάτων ἀφαιρέσεις.	And unless we can bring forward better ones in our present situation, be assured that I shall not give way to you, not even if the power of the multitude frighten us with even more terrors than at present, as children are frightened with goblins, threatening us with imprisonments and deaths and confiscations of property.	and unless we can find other and better principles on the instant, I am certain not to agree with you; no, not even if the power of the multitude could inflict many more imprisonments, confiscations, deaths, frightening us like children with hobgoblin terrors.	Wenn wir also nicht bessere als sie jetzt vorzutragen haben: so wisse nur, daß ich dir nicht nachgeben werde, und wenn auch die Macht der Menge noch mehr als schon geschieht, um uns wie Kinder einzuschrecken, Gefangenschaft und Tod auf uns los ließe und Verlust des Vermögens.	چنانکه در این وضع موجود مواجهه بهتری نداشته باشیم , و اگر اکنون قدرت اکثریت حتی بیشتر ما را به سان کودکان با تهدید به حبس‌ها و اعدام‌ها و مصادره اموال بترساند , نیک بدان که به [ رای ] شما گردن نمی‌نهم .	اگر در شرایط فعلی گزاره‌ی بهتری به چنگ نیاوریم , نیک بدان که هرگز به تو تسلیم نخواهم شد , نه حتی اگر اقتدار عموم ما را همچون کودکان بیش از شرایط حال حاضر فعلی بهراساند و به‌منظور اسارت و مرگ و مصادره‌ی دارایی‌ها به دنبالم بفرستند .	مگر اینکه سگالی بهتر در وضع موجود پیدا کنیم، نیک دانسته باش که [سگال] تو را به هیچ وجه نخواهم پذیرفت، نه حتی اگر بیشتر در وضع کنونی، با در پی اسارت‌ها و مرگ‌ها فرستادن و با مصادره کردن دارایی‌ها، قدرت عموم مردم گویی کودکان ما را بترساند.	اگر در وضع پیش آمده برهانی بهتر از این نداشته باشیم , و نه افزون تر از این ها اگر اکنون قدرت غالب با روانه کردن سویِ زندان ها و کشتارها و نیز با مصادره ی دارایی ها ما را همچون کودکان بهراساند , نیک واقف باش که تسلیم تو نمی شوم .							
0059-003|79.|Cr.46c.3.	πῶς οὖν ἂν μετριώτατα σκοποίμεθα αὐτά;	Now how could we examine the matter most reasonably?	But what will be the fairest way of considering the question?	Wie können wir also dies recht zu unserer Befriedigung untersuchen?		بنابراین چگونه به نحو احسن درباب آن‌ها بیندیشیم؟	حال چگونه به مناسبترین [ نحو ] درباره این [ وضع‌ها ] بیاندیشیم؟	در حقیقت چگونه می باید آن ها را به سزاوارترین طریق مورد ارزیابی قرار دهیم .							
0059-003|80.|Cr.46c.4.	εἰ πρῶτον μὲν τοῦτον τὸν λόγον ἀναλάβοιμεν, ὃν σὺ λέγεις περὶ τῶν δοξῶν.	By taking up first what you say about opinions and asking	Shall I return to your old argument about the opinions of men,	Wenn wir zuerst den Satz aufnehmen wegen der Meinungen von dem du sprichst,		نخست آن گزاره‌ای را در پیش بگیریم که تو پیرامون باورها و عقاید می‌گویی .	همانا باشد که نخست با این سگال درگیر شویم , که تو حول پندارها می‌گویی .	در واقع نخست این برهان را پی بگیریم که تو در خصوص قضاوت ها بر زبان می آوری .							
0059-003|81.|Cr.46d.1.	πότερον καλῶς ἐλέγετο ἑκάστοτε ἢ οὔ, ὅτι ταῖς μὲν δεῖ τῶν δοξῶν προσέχειν τὸν νοῦν, ταῖς δὲ οὔ;	whether we were right when we always used to say that we ought to pay attention to some opinions and not to others?	some of which are to be regarded, and others, as we were saying, are not to be regarded?	ob wohl für jeden Fall gut gesagt war oder nicht, daß man auf einige Meinungen zwar achten müsse, auf andere aber nicht?		آیا همواره نیک می‌گفتی یا خیر که بایستی برخی از باورها را آویزه‌ی ذهن کرد , و برخی دیگری را نه .	آیا هر بار نیک می‌گفتی یا نه , که همانا بایستی ذهن را معطوف کردن به برخی از افکارها , اما به برخی [ دیگر ] نه؟	که آیا هر بار به نیکویی بر زبان آورده می شد یا نه که ذهن را برای شماری از قضاوت ها سوق دادن می باید و برای شماری دیگر نه ؟							
0059-003|82.|Cr.46d.2.	ἢ πρὶν μὲν ἐμὲ δεῖν ἀποθνῄσκειν καλῶς ἐλέγετο, νῦν δὲ κατάδηλος ἄρα ἐγένετο ὅτι ἄλλως ἕνεκα λόγου ἐλέγετο, ἦν δὲ παιδιὰ καὶ φλυαρία ὡς ἀληθῶς;	Or were we right before I was condemned to death, whereas it has now been made clear that we were talking merely for the sake of argument and it was really mere play and nonsense?	Now were we right in maintaining this before I was condemned? And has the argument which was once good now proved to be talk for the sake of talking; in fact an amusement only, and altogether vanity?	Oder ob es zwar ehe ich sterben sollte gut gesagt war, nun aber offenbar geworden ist, daß es nur obenhin des Redens wegen gesagt, in der Tat aber nichts war als Scherz und Geschwätz?	یا تا پیش از محکوم شدن من به اعدام فصیح سخن‌ می‌راندیم , درحالیکه اکنون آشکار شده که صرفاً در پی تظاهر گفته می‌شده , براستی همچون بازی‌ و یاوه‌سرایی بوده است؟		یا از طرفی پیش‌تر از مرگ بایسته من به حق سخن گفته می‌شد، از طرفی دیگر اکنون گویی آشکار گشته است که فقط از برای حرف زدن گفت‌وگو می‌شد، که حتی در حقیقت بازی کودکانه و بی‌معنایی بود؟	در واقع همانا پیش تر از بایستن مردن من به نیکویی سخن رانده می شد لیک اینک به منصه ظهور رسید که گویی از بهر گفتاری دگرگونه سخن رانده می شد و لیکن در حقیقت نمایشی و مُهمل بود , نبود ؟	یا پیش از آنکه مرا مردن می بایست نیک خوانده میشد حال آنکه اکنون آشکار شده است که صرفا از روی سخن وری گفته آمد و لیک براستی لَهو بود و لَغو						
0059-003|83.|Cr.46d.3.	ἐπιθυμῶ δ᾽ ἔγωγ᾽ ἐπισκέψασθαι, ὦ Κρίτων, κοινῇ μετὰ σοῦ εἴ τί μοι ἀλλοιότερος φανεῖται, ἐπειδὴ ὧδε ἔχω, ἢ ὁ αὐτός, καὶ ἐάσομεν χαίρειν ἢ πεισόμεθα αὐτῷ.	And I wish to investigate, Crito, in common with you, and see whether our former argument seems different to me under our present conditions, or the same, and whether we shall give it up or be guided by it.	That is what I want to consider with your help, Crito: whether, under my present circumstances, the argument appears to be in any way different or not; and is to be allowed by me or disallowed.	Ich meines Teils habe Lust, Kriton, dies mit dir gemeinschaftlich zu untersuchen: ob diese Rede mir jetzt etwa wunderlicher erscheinen wird, nun es so mit mir steht, oder noch eben so; und dem gemäß wollen wir sie entweder gehen lassen oder ihr gehorchen.	و ای کریتون من مشتاقم که با تو مشترکاً تحقیق کنم که در پس چنین وضعی که در آن هستم آیا برای من دیگرگونه به نظرمی‌رسد یا یکسان , یا آن را رها می‌کنیم یا از آن پیروی خواهیم کرد		اما خود من مایلم مشترکاً همراه تو به وارسی کردن , ای کریتون , که آیا برای من متفاوت‌تر به نظر می‌رسد , از زمانی که چنین پیش آمده , یا همان طور است [ که بوده ] , و دست خواهیم برداشت یا از همان پیروی خواهیم کرد .	ای کریتون من برآنم به کاویدن , دوشادوش تو که آیا آن چه هم اکنون این چنین در نظرم دارم مرا به گونه ایی دیگر پدیدار خواهد گشت یا همان است ; پس یا با فروگذاردن , آن را وا خواهیم نهاد یا همان را پی خواهیم گرفت .	و من ای کریتون راغبم به وارسیدن همراه با تو که آن آیا مرا بعد از این و چنانکه در پیش رو دارم دیگرگون در نظر خواهد آمد یا یکسان است و رهایش کنیم مرخص شود یا پیروی اش کنیم						
0059-003|84.|Cr.46e.1.	ἐλέγετο δέ πως, ὡς ἐγᾦμαι, ἑκάστοτε ὧδε ὑπὸ τῶν οἰομένων τὶ λέγειν, ὥσπερ νυνδὴ ἐγὼ ἔλεγον, ὅτι τῶν δοξῶν ἃς οἱ ἄνθρωποι δοξάζουσιν δέοι τὰς μὲν περὶ πολλοῦ ποιεῖσθαι, τὰς δὲ μή.	But it used to be said, I think, by those who thought they were speaking sensibly, just as I was saying now, that of the opinions held by men some ought to be highly esteemed and others not.	That argument, which, as I believe, is maintained by many who assume to be authorities, was to the effect, as I was saying, that the opinions of some men are to be regarded, and of other men not to be regarded.	So aber, glaube ich, wurde sonst immer von denen behauptet, die etwas zu sagen meinten, wie ich jetzt eben sagte, daß von den Meinungen, welche die Menschen hegen, man einige zwar sehr hoch achten müsse, Andere aber nicht.	اما به هر روی , چنانکه به نظرم می‌آید , در هر مناسبتی از سوی کسانی که سخن سنجیده گویند نقل شده , به سان آنچه که اکنون گفتمِ , که برخی از آن عقاید که مردم به آنها اعتقاد می‌ورزند را می‌بایست بسیار ارج نهاد و برخی را نه .		اما به هر صورتی که گفته می‌شد، آنطور که فکر می‌کنم، در هر شرایطی به گونه‌ای توسط اندیشمندان که سنجیده سخن می‌گویند، همان طور که من اکنون می‌گفتم، که افکارهایی را که مردمان می‌پندارند باید همانا به برخی ارزش قائل شد، اما به برخی نه.	لیک بر این باورم که هر بار بدین منوال , سخن گفتن از سوی سخن‌گویانِ نکته سنج , و به هر نحوی که گفته می‌شد , بسانِ همین باشد که من اکنون بر زبان آوردم , که بایستی شماری از قضاوت هایی که آدمیان در سر می‌پرورانند را ارجِ بسیار نهادن و شماری را نه .	و به گمانم هر بار که به هر روی بدین صورت از جانب آنانکه اندیشیده سخن گویند سخنی گفته شده است چنان است که من اکنون گفتم : که آرایی که آدمیان باور دارند می بایست برخی را بسیار به حساب آورد و برخی دیگر را نه .						
0059-003|85.|Cr.46e.2.	τοῦτο πρὸς θεῶν, ὦ Κρίτων, οὐ δοκεῖ καλῶς σοι λέγεσθαι; —	In God's name, Crito, do you not think this is correct?	%% not translated %%	Sprich nun, Kriton, bei den Göttern dünkt dich dies nicht gut gesagt zu sein?	بنابراین از بهر خدایان , ای کریتون , نزد تو سخنی درست به نظر نمی‌رسد؟	به خدایان سوگند , کریتون , این سخن برای تو برحق نمی‌نماید؟	پناه بر ایزدان , ای کریتون , تو می‌پنداری که این سگال درست نیست ؟ -	بهر خاطرِ ایزدان ! ای کریتون ! زین‌سان سخن گفتن تو را راستین در نظر نیاید ؟	برای خاطر خدایان ای کریتون آیا این استدلال ترا نیک در نظر نیاید ؟						
0059-003|86.|Cr.47a.1.	σὺ γάρ, ὅσα γε τἀνθρώπεια, ἐκτὸς εἶ τοῦ μέλλειν ἀποθνῄσκειν αὔριον, καὶ οὐκ ἂν σὲ παρακρούοι ἡ παροῦσα συμφορά:	For you, humanly speaking, are not involved in the necessity of dying tomorrow, and therefore present conditions would not lead your judgment astray.	Now you, Crito, are a disinterested person who are not going to die to-morrow- at least, there is no human probability of this, and you are therefore not liable to be deceived by the circumstances in which you are placed.	Denn du bist doch menschlichem Ansehen nach fern davon Morgen sterben zu müssen, und das bevorstehende Schicksal könnte dich nicht berücken.	چراکه تو , چنانچه بعنوان انسان سخن بگوییم/تا آنجا که سخن بشر باشد , از مردن مقرر فردا به دور هستی , و در شرایط کنونی گمراه نخواهی شد :	چراکه تو فردا , دست‌کم تا آنجا که نفس انسانی حکم می‌کند , خارج از دایره اجل مقرر هستی و این مصیبت‌های‌‌ سررسیده تو را گمراه نخواهند کرد .	چرا که تو، کمابیش به همان اندازه وجه انسانی، از مرگ ممهور فردا مبرّا هستی، و وضعیت کنونی تو را فریب ندهد:	چه به قدری که بر آدمی آشکار تواند بود , تو فردا ورایِ مقدّر بودنِ مردنِ خویش ایی و این واقعه‌ی مختوم تو را به بیراهه نکشاند .	زیرا که تو لااقل با نگاهی بشری فردا برون از تقدیر مردن هستی و باشد که بداقبالی کنونی ترا منحرف نکند						
0059-003|87.|Cr.47a.2.	σκόπει δή — οὐχ ἱκανῶς δοκεῖ σοι λέγεσθαι ὅτι οὐ πάσας χρὴ τὰς δόξας τῶν ἀνθρώπων τιμᾶν ἀλλὰ τὰς μέν, τὰς δ᾽ οὔ, οὐδὲ πάντων ἀλλὰ τῶν μέν, τῶν δ᾽ οὔ;	Now say, do you not think we were correct in saying that we ought not to esteem all the opinions of men, but some and not others, and not those of all men, but only of some?	Tell me, then, whether I am right in saying that some opinions, and the opinions of some men only, are to be valued, and other opinions, and the opinions of other men, are not to be valued.	Erwäge also: scheint dir das nicht gut gesagt daß man nicht alle Meinungen der Menschen ehren muß, sondern einige wohl, andere aber nicht? und auch nicht aller Menschen, sondern einiger ihre wohl, Anderer aber nicht?	لیکن در نظرآور , تو فکرنمی‌کنی استدلال بسنده‌ای است اینکه ارج نهادن به تمامی عقاید مردم بایسته نیست , اما به برخی [ باید ارج نهاد ] و به برخی دیگر نه , ونه هرچیزی بلکه به برخی و به برخی دیگر نه؟	حال , ملاحظه کن : برای تو این سخنی درخور نمی‌نماید که بهادادن به جملگی عقاید آدمیان الزامی نیست , بلکه تنها پاره‌ای از عقاید , اما نه همه . آن‌هم نه همه‌ی آدمیان بلکه شماری از آن‌ها , نه همه .	حال بنگر – آیا تو نمی‌پنداری به این سگال بسنده کرد که می‌بایست نه تمامی افکار آدمیان را احترام گذاردن بلکه برخی را , و برخی دیگر را نه , نه همه را بلکه برخی از آن‌ها را , و برخی از آن‌ها را نه؟	باری بنگر که بدین‌سان برهان آوردن تو را به قدر کفایت در نظر نیاید ؟ این‌که می‌باید نه به تمامی , بلکه شماری از قضاوت‌های مردمان را گرامی داشتن و شماری دیگر را نه ; و آن نیز نه از همگان بلکه از اقلیّتی و باز از عده‌ایی دیگر نه !	پس بسنج , به نظرت این استدلال کافی نمی رسد که نه همه باورهای آدمیان , بلکه برخی را شریف شمردن دربایست است و برخی دیگر را نه و نه همچنین است باورهایی از همه آدمیان , بلکه از برخی بلی و از برخی دیگر نه .						
0059-003|88.|Cr.47a.3.	τί φῄς;	What do you think?	I ask you whether I was right in maintaining this?	Was meinst du?	چه می‌گویی؟	چه می‌گویی؟	چه می‌گویی؟	تا تو چه گویی ؟	چه می گویی ؟						
0059-003|89.|Cr.47a.4.	ταῦτα οὐχὶ καλῶς λέγεται;	Is not this true?	%In precious sentence%	ist das nicht gut gesagt?	این سخن درست نیست؟	این‌ها سخنانی برحق نیستند؟	آیا این درست گفته نمی‌شود ؟	این‌ها برهان آوردن ایی راستین نباشد ؟	آیا این نیک استدلال نشده است ؟						
0059-003|90.|Cr.47a.5.	Κρίτων. καλῶς.	Crito. It is.	Cr. Certainly.	Kriton: Gut.	درست است	برحق هستند .	درست است .	کریتون : راستین باشد .	نیک .						
0059-003|91.|Cr.47a.6.	Σωκράτης. οὐκοῦν τὰς μὲν χρηστὰς τιμᾶν, τὰς δὲ πονηρὰς μή;	Socrates. Then we ought to esteem the good opinions and not the bad ones?	Soc. The good are to be regarded, and not the bad?	Sokrates: Nämlich doch die guten Meinungen soll man ehren, die schlechten nicht?	پس نبایستی به آن قسم سزاوارها ارج نهاد و نه به آن دیگر ناسزاوارها؟	و بر این اساس , امر سودمند را بهادادن و نه امر بی‌ارزش را؟	بنابراین همانا [ پندارهای ] مفید را احترام گذاردن , اما [ پندارهای ] بیهوده را نه ؟	سقراط : آنگاه به راستی سزد که ارزشمند را گرامی داشتن و لیک بی‌ارزش را نه ؟	پس یقینا سودمند را شریف شمردن بایست و نه بی فایده را ؟						
0059-003|92.|Cr.47a.7.	Κρίτων. ναί.	Crito. Yes.	Cr. Yes.	Kriton: Ja.	واقعا	بله.	آری.	کریتون : آری .	بلی						
0059-003|93.|Cr.47a.8.	Σωκράτης. χρησταὶ δὲ οὐχ αἱ τῶν φρονίμων, πονηραὶ δὲ αἱ τῶν ἀφρόνων;	Socrates. And the good ones are those of the wise and the bad ones those of the foolish?	Soc. And the opinions of the wise are good, and the opinions of the unwise are evil?	Sokrates: Und die guten, sind das nicht die der Vernünftigen, die schlechten aber die der Unvernünftigen?	ونه این است که سزاوارهایش ازآنِ خردمندان و ناسزاوارهایش از آن نادانان است؟	آیا این‌گونه نیست که عقاید خردمندان سودمند است و عقاید نابخردان خیر؟	مگر آنِ دانایان مفید نیست , و آنِ نادانان بیهوده ؟	سقراط : مگر جز این است که از آنِ خردمندان ارزشمند باشد و از آنِ بی‌خردان بی ارزش ؟	و نه اینکه سودمند از آن خردمندان است و بی فایده از آن بی خردان ؟						
0059-003|94.|Cr.47a.9.	Κρίτων. πῶς δ᾽ οὔ;	Crito. Of course.	Cr. Certainly.	Kriton: Wie anders?	جز این نیست .	البته.	البته .	کریتون : حاشا چگونه غیرِ این باشد ؟	چرا که نه						
