Sentence number	Greek	Fowler	Jowett	Schleiermacher	Rahimi	Nikpour	Mohammadi	Mahmoudzadeh	Assimi						
0059-003|1.|Cr.43a.1.	Σωκράτης. τί τηνικάδε ἀφῖξαι, ὦ Κρίτων;	Socrates. Why have you come at this time, Crito?	Soc. Why have you come at this hour, Crito?	Sokrates: Wie bist du schon um diese Zeit gekommen, Kriton?		کریتون , چرا این وقت روز آمده‌ای ؟	ای کریتون، برای چه بدین زودی آمده‌ای؟	سقراط: چرا اینسان زود آمده ایی کریتون ؟	چطور در این وقت آمده ای , ای کریتون؟						
0059-003|2.|Cr.43a.2.	ἢ οὐ πρῲ ἔτι ἐστίν;	Or isn't it still early?	it must be quite early.	Oder ist es nicht noch früh?		آیا هنوز زود نیست ؟	یا هنوز زود نیست ؟	یا اینکه اکنون خیلی زود نیست ؟	یا دیگر زود هم نیست؟						
0059-003|3.|Cr.43a.3.	Κρίτων. πάνυ μὲν οὖν.	Crito. Yes, very early.	Cr. Yes, certainly.	Kriton: Noch gar sehr.		. کریتون به‌واقع خیلی	آری چنین است .	البته که چنین است .	چرا یقینا همینطور است . 						
0059-003|4.|Cr.43a.4.	Σωκράτης. πηνίκα μάλιστα;	Socrates. About what time?	Soc. What is the exact time?	Sokrates: Welche Zeit wohl?	به راستی چه وقت/موقع است؟	سقراط حدوداً چه ساعتی است ؟	حدوداً چه زمانی است ؟	سقراط: حدوداً چه زمانی است ؟	دقیقا چه وقت است؟						
0059-003|5.|Cr.43a.5.	Κρίτων. ὄρθρος βαθύς.	Crito. Just before dawn.	Cr. The dawn is breaking.	Kriton: Die erste Morgendämmerung.	پیش از سپیده‌دم .	. کریتون درست پیش از سپیده‌دم	به هنگام گرگ و میش صبح .	کریتون: اندکی تا سپیده دم .	پیش از سپیده سحر						
0059-003|6.|Cr.43a.6.	Σωκράτης. θαυμάζω ὅπως ἠθέλησέ σοι ὁ τοῦ δεσμωτηρίου φύλαξ ὑπακοῦσαι.	Socrates. I am surprised that the watchman of the prison was willing to let you in.	Soc. I wonder the keeper of the prison would let you in.	Sokrates: Da wundere ich mich, daß der Schließer des Gefängnisses dir aufmachen gewollt hat.	درعحبم که نگهبان زندان اینچنین به پذیرفتن‌ات/ راه دادن ‌ات مایل شد .	. سقراط تعجب می‌کنم چطور نگهبان زندان به تو اذن ورود داد	در شگفتم که چگونه نگهبان زندان به داخل شدن تو [به سلول من] راضی شد!	سقراط: درشگفتم نگهبان زندان چگونه راضی به گشودنِ در برای تو شد ؟	در عجبم که چطور این نگهبان زندان خوش داشته ترا بنیوشد .						
0059-003|7.|Cr.43a.7.	Κρίτων. συνήθης ἤδη μοί ἐστιν, ὦ Σώκρατες, διὰ τὸ πολλάκις δεῦρο φοιτᾶν, καί τι καὶ εὐεργέτηται ὑπ᾽ ἐμοῦ.	Crito. He is used to me by this time, Socrates, because I come here so often, and besides I have done something for him.	Cr. He knows me because I often come, Socrates; moreover. I have done him a kindness.	Kriton: Er ist schon gut bekannt mit mir, Sokrates, weil ich oft hieher komme. Auch hat er wohl eher etwas von mir erhalten.	از پیش با من آشنا است ,ای سقراط , چراکه  اغلب به اینجا می آیم، ونیز از من چیزی به او رسیده است.	کریتون سقراط , او از پیش با من آشناست , زیرا رفت‌و‌آمدم بدین‌سو بسیار است , و گذشته از این از قِبل من چیزی به سود برده است .	به دلیل رفت‌وآمد بسیار به اینجا دیگر به من عادت کرده است، ای سقراط، همچنین از من به او لطفی و نفعی رسیده است.	به خاطرِ رفت و آمد بسیار بدین جا دیگر با من آشناست , ای سقراط !وانگهی از سویِ من تطمیع نیز شده است .	چندی است که به خاطر تردد مکرر بدینجای آشنای من است , ای سقراط و به علاوه از جانب من به او خیر رسیده است .						
0059-003|8.|Cr.43a.8.	Σωκράτης. ἄρτι δὲ ἥκεις ἢ πάλαι;	Socrates. Have you just come, or some time ago?	Soc. And are you only just come?	Sokrates: Bist du eben erst gekommen oder schon lange?	هماکنون یا زودتر رسیده‌ای؟	سقراط اما تازه آمده‌ای یا خیلی وقت است ؟	لیک همین حالا رسیده‌ای یا مدتی می‌شود؟	سقراط: لیک اینک رسیده ایی یا پیش تر ؟	تازه رسیده ای یا دیرگاهی است؟						
0059-003|9.|Cr.43b.1.	Κρίτων. ἐπιεικῶς πάλαι.	Crito. Some little time ago.	Cr. No, I came some time ago.	Kriton: Schon ziemlich lange.	دیرگاهی است.	. کریون مدتی است	نسبتاً دیرگاهی است.	کریتون: قدری پیش تر .	کمابیش دیرگاهی است .						
0059-003|10.|Cr.43b.2.	Σωκράτης. εἶτα πῶς οὐκ εὐθὺς ἐπήγειράς με, ἀλλὰ σιγῇ παρακάθησαι;	Socrates. Then why did you not wake me at once, instead of sitting by me in silence?	Soc. Then why did you sit and say nothing, instead of awakening me at once?	Sokrates: Warum also hast du mich nicht gleich geweckt, sondern dich so still hingesetzt?	پس چرا بی‌درنگ مرا  بیدار نکردی, بل بی‌صدا در کنارم نشستی؟	سقراط پس چطور مرا همان‌وقت بیدار نکردی عوضِ آن‌که خاموش کناری بنشینی ؟	پس برای چه مرا همان لحظه بیدار نکرده‌ای , و در عوض در سکوت در کنار [ من ] نشسته‌ای ؟	پس اما چگونه بی آنکه بی درنگ مرا بیدار کنی خاموش بر بالین ام نشستی ؟	پس چرا فورا بیدارم نکردی و همینطور کنارم خاموش نشستی؟						
0059-003|11.|Cr.43b.3.	Κρίτων. οὐ μὰ τὸν Δία, ὦ Σώκρατες, οὐδ᾽ ἂν αὐτὸς ἤθελον ἐν τοσαύτῃ τε ἀγρυπνίᾳ καὶ λύπῃ εἶναι, ἀλλὰ καὶ σοῦ πάλαι θαυμάζω αἰσθανόμενος ὡς ἡδέως καθεύδεις:	Crito. No, no, by Zeus, Socrates, I only wish I myself were not so sleepless and sorrowful. But I have been wondering at you for some time, seeing how sweetly you sleep;	Cr. Why, indeed, Socrates, I myself would rather not have all this sleeplessness and sorrow. But I have been wondering at your peaceful slumbers,	Kriton: Nein, beim Zeus, Sokrates, wollte ich doch selbst lieber nicht so lange gewacht haben in solcher Betrübnis. Aber sogar dir habe ich schon lange verwundert zugesehen, wie sanft du schliefst;	سوگند به زئوس نه , ای سقراط , کاش خود دوست نداشتم دیرزمان در شب‌زنده‌داری و رنج درگیرشوم , اما از این گذشته چندی پیش محو تماشای تو بوده‌ام که چگونه آرام خفته‌ای ; 	ای سقراط ; نه به زئوس [ قسم ] , خودم میل داشتم که اگر [ ممکن بود ] بسی بی خواب و اندوهگین نبودم ; لیکن دیرزمانی است که از تو در شگفتم , می بینم خوش خوابیده ای ;   ++ برای خاطر خدا حرفش را هم نزن سقراط . خودِ من نمی‌خواستم این‌چنین در بی‌خوابی و رنج باشم , اما مدتی است از دیدنِ تو که چه آسوده می‌خوابی در شگفتم	سوگند به زئوس، نه سقراط! شاید می‌خواستم خودم در بی‌خوابی و نیز رنج چنین عظیمی نبودم، و دیگر اینکه دیربازی در حال دیدن اینکه در خواب شیرین بودی، بر تو خیره بودم:	ای سقراط ! سوگند به زئوس چنین مباشد . من خود , بودن در این بسیاریِ رنج و بی خوابیِ را نمی خواستم , لیک دیری ست در حالِ نگریستنِ تو ام و در حیرت ام که چه سان دلپذیر خفته ایی	نه , به زئوس , سقراط شایق بودم که خود چنین بیخواب و رنجور نباشم , اما چندی است با دیدن اینکه چه خوش خفته ای از تو در شگفتم						
0059-003|12.|Cr.43b.4.	καὶ ἐπίτηδές σε οὐκ ἤγειρον ἵνα ὡς ἥδιστα διάγῃς.	and I purposely refrained from waking you, that you might pass the time as pleasantly as possible.	and that was the reason why I did not awaken you, because I wanted you to be out of pain.	und recht wohlbedächtig habe ich dich nicht geweckt, damit dir die Zeit noch recht sanft hingehe.	و عمداً به این دلیل بیدارت نکردم که همچنان به‌خوشایندی تداوم‌اش‌دهی .	و عمداً تورا بیدار نکردم تا در اینجا که به خوشی سر کنی ++ و عمداً تو را بیدار نکردم تا مگر گذران مطبوعی داشته باشی .	و به قصد تو را بیدار نکردم تا زمانی را در آسوده‌ترین حالت ممکن سپری کنی .	و به عمد تو را بیدار نمی کردم از این رو که چنین مطبوع گذرِ زمان را بر می تابی	و عمدا بیدارت نکردم تا همانطور خوش وقتت بگذرد .						
0059-003|13.|Cr.43b.5.	καὶ πολλάκις μὲν δή σε καὶ πρότερον ἐν παντὶ τῷ βίῳ ηὐδαιμόνισα τοῦ τρόπου, πολὺ δὲ μάλιστα ἐν τῇ νῦν παρεστώσῃ συμφορᾷ, ὡς ῥᾳδίως αὐτὴν καὶ πρᾴως φέρεις.	I have often thought throughout your life hitherto that you were of a happy disposition, and I think so more than ever in this resent misfortune, since you bear it so easily and calmly.	I have always thought you happy in the calmness of your temperament; but never did I see the like of the easy, cheerful way in which you bear this calamity.	Denn oft schon freilich auch sonst im ganzen Leben habe ich dich glücklich gepriesen deiner Gemütsart wegen, bei weitem aber am meisten bei dem jetzigen Unglück wie leicht und gelassen du es erträgst.	و نیز اغلب شما را به دلیل سلوکتان و زندگی‌ شادکامانه تمجید کرده‌ام، اما در این تیره‌بختی و کینه‌توزی کنونی، بیش از پیش [شما را تمجید می‌کنم]، چراکه راحت و آرام آن را تحمل می‌کنید.	.و در واقع تو را اغلب و تا کنون در سراسر زندگانی ات دارای مناعت طبع [ دانسته ام ] ;و من بیش از همیشه اکنون در [ فکر ] نگون بختی اخیر [ هستم ] زیرا که تو خود را در فراغ بالی و متانت قرار می دهی . ++   و من پیش از این اغلب تو را از طریق کردار زندگی‌ات شاد خواندم , و حتی اکنون بیش از پیش قدعلم‌کرده دربرابر تیره‌بختی , تو آن را چه سهل و آرام. تاب می‌آوری	و پیش‌تر از طرفی هم در طول زندگانی‌ات اغلب اوقات تو را به گونه‌ای شادمان می‌دانستم، اما اکنون بیش از پیش که در این بدشگونی در حال وقوع، به آسانی و به آرامی آن را متحمل می‌شوی.	و به راستی پیش تر نیز بارها بهرِ منش ات در تمام زندگی تو را نیکبخت پنداشته ام و حال در این تیره بختیِ پیش آمده بسی بیشتر که بدین سان به آسودگی و سبکبالی تاب اش می آوری .	و من اغلب تا کنون ترا در زندگی ات دارای منشی سعادتمند قلمداد کرده ام و اینکه خودت چه سهل این بداقبالی کنونی را متحمل شده ای مرا در این نظر راسخ تر کرده است .						
0059-003|14.|Cr.43c.1.	Σωκράτης. καὶ γὰρ ἄν, ὦ Κρίτων, πλημμελὲς εἴη ἀγανακτεῖν τηλικοῦτον ὄντα εἰ δεῖ ἤδη τελευτᾶν.	Socrates. Well, Crito, it would be absurd if at my age I were disturbed because I must die now.	Soc. Why, Crito, when a man has reached my age he ought not to be repining at the prospect of death.	Sokrates: Es wäre ja auch frevelhaft, o Kriton, mich in solchem Alter unwillig darüber zu gebärden, wenn ich endlich sterben muß.	البته چنین خواهد بود , ای کریتون , اگر بایستی اکنون بمیرم , برآشفتگی در سن و سال من شرم‌آور خواهد بود	. و به همین دلیل , کریتون , چه‌بسا ناشایست باشد اگر در این سن عصیان‌گر باشم , همین حالا هم درگذشتن اقتضا می‌کند	و برای همین، ای کریتون، اگر حال که ناگزیر مرگ من فرا رسیده است شاید آزرده خاطر شدن با این کهولت سن ناهمگون می‌شد.	به راستی ای کریتون بادا که پریشان خاطر شدن در این سن نابسزا باشد اگر که می بایست حال به فرجامِ عمر رسیدن .	باری , ای کریتون شرم آور است که در چنین سنی که دیگر وقت مردن است بر خود بلرزم .						
0059-003|15.|Cr.43c.2.	Κρίτων. καὶ ἄλλοι, ὦ Σώκρατες, τηλικοῦτοι ἐν τοιαύταις συμφοραῖς ἁλίσκονται, ἀλλ᾽ οὐδὲν αὐτοὺς ἐπιλύεται ἡ ἡλικία τὸ μὴ οὐχὶ ἀγανακτεῖν τῇ παρούσῃ τύχῃ.	Crito. Other men as old, Socrates, become involved in similar misfortunes, but their age does not in the least prevent them from being disturbed by their fate.	Cr. And yet other old men find themselves in similar misfortunes, and age does not prevent them from repining.	Kriton: Werden doch auch Andere, Sokrates, eben so bejahrte von solchem Unglück bestrickt; aber ihr Alter schützt sie nicht davor, sich nicht unwillig zu gebärden gegen das eintretende Geschick.	البته ای سقراط , دیگرانی پیرتر در مصیبت‌های مشابهی گرفتار آمده‌اند اما با اینحال سنشان هیچکدام‌ شان را از برآشفتگی دررسیدن تقدیرشان نرهانیده است .	دیگر سالخوردگان سقراط به چنین تیره‌بختی‌ای گرفتار می‌شوند , اما ابداً سن‌و‌سال آنها را از عصیان در محضر سرنوشت . بازنمی‌دارد	و نیز دیگرانی، ای سقراط، با همین سن در این چنین مصیبتی گرفتار آمده‌اند، ولی طول عمر به هیچ وجه آن‌ها را از آزرده خاطر شدن‌شان از تقدیر رخ داده برایشان باز نمی‌دارد.	ای سقراط ! دیگرانی هم در این سن به چنین تیره بختی هایی دچار می گردند اما سن شان آنان را به هیچ روی از پریشان خاطر شدن بهرِ قضا و قدر باز نمی دارد .	دیگرانی , ای سقراط در همین سن گرفتار چنین بداقبالی ای اند , اما سال عمرشان ایشان را نه از چیزی رهانیده و نه حتی از بر خود لرزیدن به نزد فرجام بازداشته است .						
0059-003|16.|Cr.43c.3.	Σωκράτης. ἔστι ταῦτα.	Socrates. That is true.	Soc. That may be.	Sokrates: Wohl wahr!	هستند ,	درست است .	چنین است .	سقراط: چنین است .	همینطور است .						
0059-003|17.|Cr.43c.4.	ἀλλὰ τί δὴ οὕτω πρῲ ἀφῖξαι;	But why have you come so early?	But you have not told me why you come at this early hour.	Aber warum doch bist du so früh gekommen?	اما چرا بدین پگاه آمده‌ای؟	اما چرا این‌قدر زود آمده‌ای ؟	ولی برای چه بدین‌گونه زود آمده‌ای ؟	اما از چه روی این سان زود آمده ایی ؟	اما چرا اینقدر زود آمده ای ؟						
0059-003|18.|Cr.43c.5.	Κρίτων. ἀγγελίαν, ὦ Σώκρατες, φέρων χαλεπήν, οὐ σοί, ὡς ἐμοὶ φαίνεται, ἀλλ᾽ ἐμοὶ καὶ τοῖς σοῖς ἐπιτηδείοις πᾶσιν καὶ χαλεπὴν καὶ βαρεῖαν, ἣν ἐγώ, ὡς ἐμοὶ δοκῶ, ἐν τοῖς βαρύτατ᾽ ἂν ἐνέγκαιμι.	Crito. To bring news, Socrates, sad news, though apparently not sad to you, but sad and grievous me and all your friends, and to few of them, I think, so grievous as to me.	Cr. I come to bring you a message which is sad and painful; not, as I believe, to yourself but to all of us who are your friends, and saddest of all to me.	Kriton: Um dir eine traurige Botschaft zu bringen, Sokrates. Nicht dir, wie ich wohl sehe, aber mir und allen deinen Freunden traurig und schwer, und die ich wie mich dünkt ganz besonders am schwersten ertragen werde.	ای سقراط , آورندهٔ خبرهای ناگوار هستم , نه چنانکه بر من آشکار است برای تو , اما برای من و همه آن دوست‌داران‌ات البته سخت و جانگداز , چه به نظرم می‌آید برای من سخت‌ترین‌ها دوام آوردن‌ام درمیانه آنها است .	سقراط , حامل خبری طاقت‌فرسا هستم , نه برای تو , چنانکه بر من پیداست , اما طاقت‌فرسا و گران برای من و همه‌ی دوستان تو .. چه‌بسا در میان آن‌ها , چنانکه به نظر من می‌رسد , من آن را به گران‌ترین حالت حمل کرده‌ام	حامل پیامی اندوهناک هستم، ای سقراط، نه برای تو، آنگونه که برای من آشکار است، بلکه برای من و تمامی دوستداران‌ات سخت و هم گران است، آن [خبر] من، چنانکه می‌پندارم، در میان آن‌ها برای من [از همه بیشتر] گران می‌آید.	کریتون: ای سقراط ! پیامی دشوار را آورنده ام . البتّه نه برایِ تو آنگونه که بر من پیدا ست , امّا بس دشوار و گران برای من و جُمله یاران ات , چنانکه می پندارم در بین آنان من اش چه گران تر بر دوش کشیدمی .	برای آوردن خبر , ای سقراط , خبری ناگوار و چنانکه بر من هویداست نه چنان ناگوار برای تو . اما برای من و تمام دوستدارانت هم ناگوار و هم گران و بر من چنانکه خود می دانم گران ترین تا حمل کنم .						
0059-003|19.|Cr.43c.6.	Σωκράτης. τίνα ταύτην;	Socrates. What is this news?	Soc. What!	Sokrates: Was doch für eine?	کدام اش‌؟	چه خبری ؟	این [ خبر ] چیست ؟	چه باشد آن ؟	کدام خبر ؟						
0059-003|20.|Cr.43d.1.	ἢ τὸ πλοῖον ἀφῖκται ἐκ Δήλου, οὗ δεῖ ἀφικομένου τεθνάναι με;	Has the ship come from Delos, at the arrival of which I am to die?	I suppose that the ship has come from Delos, on the arrival of which I am to die?	Ist etwa das Schiff aus Delos zurückgekommen, nach dessen Ankunft ich sterben soll?	مگر آن کشتی از دلوس رسیده‌است , آنکه با آمدنش لازم است مرده باشم .	مگر آن کشتی , که با ورود آن مرا می‌بایست مردن , از دلوس رسیده است ؟	یا کشتی از دلوس رسیده است، آنکه با رسیدنش مرگ من ملزوم می‌شود؟	مگر آن کشتی از دلوس رسیده است , همان که با آمدن اش می بایست مرا بدرود حیات گفتن .	آیا آن کشتی که رسیدنش از دلوس مقتضی مرگ من است رسیده است ؟						
0059-003|21.|Cr.43d.2.	Κρίτων. οὔτοι δὴ ἀφῖκται, ἀλλὰ δοκεῖν μέν μοι ἥξει τήμερον ἐξ ὧν ἀπαγγέλλουσιν ἥκοντές τινες ἀπὸ Σουνίου καὶ καταλιπόντες ἐκεῖ αὐτό.	Crito. It has not exactly come, but I think it will come today from the reports of some men who have come from Sunium and left it there.	Cr. No, the ship has not actually arrived, but she will probably be here to-day, as persons who have come from Sunium tell me that they have left her there;	Kriton: Noch ist es zwar nicht hier, aber ich glaube doch es wird heute kommen, nach dem was Einige von Sunion gekommene berichten, die es dort verlassen haben.	نه درواقع نرسیده، اما بر اساس گزارش برخی از افراد که از سونیون آمده و آنجا را ترک کرده‌اند، فکر می‌کنم که امروز می‌آید.	همین حالا نیامده است , اما به نظرم همین امروز خواهد آمد . آنان که از سونیون آمده‌ و کشتی آنجا نهاده‌اند , از آنان خبر رسیده. است .	هنوز نرسیده است، اما به راستی من فکر می‌کنم که امروز خواهد آمد از آنجاییکه کسانی که از سونیون آمده‌ و آن [کشتی] را آنجا رها کرده خبر آورده‌اند.	کریتون: فعلاً نرسیده است , امّا به باورم امروز دیگر خواهد آمد زیرا کسانی که از سونیون رسیده اند و آن کشتی بدانجا وانهاده اند چنین خبر می دهند .	هنوز دقیقا نرسیده است . اما طبق گزارشات آنانی که از سونیوم آمده اند و کشتی را درآنجا واگذاشتند فکر کنم حتما امروز برسد .						
0059-003|22.|Cr.43d.3.	δῆλον οὖν ἐκ τούτων τῶν ἀγγέλων ὅτι ἥξει τήμερον, καὶ ἀνάγκη δὴ εἰς αὔριον ἔσται, ὦ Σώκρατες, τὸν βίον σε τελευτᾶν.	Now it is clear from what they say that it will come today, and so tomorrow, Socrates, your life must end.	and therefore to-morrow, Socrates, will be the last day of your life.	Aus dieser Nachricht nun ergibt sich, daß es heute kommt,		درواقع , واضح است از این پیام‌آوران که امروز خواهد رسید , و فردا ای سقراط خاتمه‌یافتن زندگی تو بایسته خواهد بود	حال از این پیام‌آوران آشکار است که امروز خواهد آمد , و اینک فردا لازم خواهد بود , ای سقراط , که زندگی تو پایان یابد .	از این پیام‌آوران بَس هویدا که امروز خواهد آمد، ای سقراط ! چه آنگاه فردا به فرجام رسیدنِ عمر تو ناگزیر است.	از این گزارشات پیداست که امروز خواهد رسید و بنابراین فردا , ای سقراط , پایان خواهد پذیرفت .						
0059-003|23.|Cr.43d.4.	Σωκράτης. ἀλλ᾽, ὦ Κρίτων, τύχῃ ἀγαθῇ, εἰ ταύτῃ τοῖς θεοῖς φίλον, ταύτῃ ἔστω:	Socrates. Well, Crito, good luck be with us! If this is the will of the gods, so be it.	Soc. Very well, Crito; if such is the will of God, I am willing;	Sokrates: Also, o Kriton, Glück auf! Wenn es den Göttern so genehm ist, sei es so.	ای کریتون، خوشا چنین بخت؛ اگر برای خدایان بدین خوشایندی است، چنین بادا.	باری , ای کریتون , بخت یارت , اگر این در نظر خدایان مقبول است , چنین باد :	اما توخه رئوف باشد ، ای کریتون، اگر برای ایزدان اینگونه خوشایند است، چنین باد:	لیک ای کریتون , نیک بختی ست اگر مُرادِ خدایان بر این باشد . چنین باد .	خب ای کریتون , خوشا بدین بخت , اگر خدایان را خوشایندی بدین سان است , ایدون باد .						
0059-003|24.|Cr.43d.5.	οὐ μέντοι οἶμαι ἥξειν αὐτὸ τήμερον.	However, I do not think it will come today.	but my belief is that there will be a delay of a day.	Jedoch glaube ich nicht, daß es heute kommt.	با وجود این، فکر نمی‌کنم امروز بیاید.	گرچه گمان نمی‌برم آن کشتی امروز بیاید .	اگر چه فکر نمی‌کنم آن [کشتی] امروز بیاید.	گرچه رسیدنِ آن کشتی بدین روز باور ندارم .	من اما فکر نمیکنم که امروز بیاید .						
